{
  "runId": "2026-06-08-compiler-roadshow",
  "mode": "creative",
  "status": "in-progress",
  "input": {
    "type": "text",
    "summary": "Compiler Roadshow"
  },
  "artifacts": {
    "deckPlan": null,
    "semanticIr": null,
    "manifest": null,
    "pptx": null,
    "previews": [],
    "reviews": [],
    "consistencyReport": null,
    "sources": "sources.json",
    "assetRegistry": "assets/asset-registry.json",
    "creativeCandidates": null,
    "creativeSelection": null,
    "blindPacket": null
  }
}
